Word,Semantic label,Prevalence,Short interpretation
IW01,monitoring/listening,59.79%,"Dominant attention state; an attentive monitoring or listening-like nonverbal state, not empty inactivity."
IW11,secondary monitoring/waiting,6.40%,Secondary monitoring/waiting state that often precedes later active responses.
IW08,active left-hand approach,4.72%,Important active response word: left-hand approach/reach with partner-directed gaze.
IW06,task-focused left withdrawal/action,6.67%,Common task-focused left-hand withdrawal/action word; often appears as an active response candidate.
IW07,task-focused right approach,5.38%,Common task-focused right-hand approach word with moderate motion.
IW04,strong task-focused right action,3.12%,"Stronger task-focused right-hand action, likely active manipulation or reaching in the shared workspace."
